{
  "id": "TICKET-IMPL-049",
  "story": "STORY-058",
  "plan": "PLAN-049",
  "implemented_by_model": "Opus 5.5",
  "status": "done",
  "files_changed": [
    "src/game/conquest.ts",
    "src/game/conquest.test.ts",
    "src/globe/main.ts",
    "tests/e2e/conquest.e2e.ts"
  ],
  "change_summary": "conquest(hasLand): kotivaltion ja kaupunkien valtioiden maattomat läänit lisätään hallussa oleviin. provinceHasLand() välimuistilla. Valtiotason siru \"Ei maata\".",
  "impact_analysis": {
    "changed_symbols": [
      "conquest(hasLand)"
    ],
    "call_sites_found": [
      "conquestNow"
    ],
    "call_sites_updated": [
      "src/globe/main.ts"
    ],
    "compile_errors_before": 0,
    "compile_errors_after": 0,
    "notes": "Oletus hasLand = aina maata pitää aiemmat kutsut ennallaan."
  },
  "commit": "9c3c99a",
  "progress": 100
}
