{
  "id": "TICKET-IMPL-023",
  "story": "STORY-033",
  "plan": "PLAN-023",
  "implemented_by_model": "Opus 5.5",
  "status": "done",
  "files_changed": [
    "src/game/improvements.ts",
    "src/game/improvements.test.ts",
    "src/game/units.ts",
    "src/game/units.test.ts",
    "src/game/cities.ts",
    "src/game/cities.test.ts",
    "src/globe/unitLayer.ts",
    "src/ui/gameHud.ts",
    "src/ui/hud.css",
    "src/globe/main.ts",
    "tests/e2e/improvements.e2e.ts"
  ],
  "change_summary": "Uudisasukkaalla on tehtävä Asuta tai Kehitä (HUD:n valitsin). Kehitä-tilassa se valitsee kannattavimman työn kotikaupunkinsa (tai lähimmän kaupungin) työstämistä ruuduista tai kahdesta seuraavasta, kävelee sinne ja tekee työn civ1-päivissä: kastelu +1 ruoka (5 pv, kukkulat 10, vaatii meren tai kastellun naapurin), kaivos +1 tai +3 tuotantoa (5–10 pv) ja tie +1 kauppa (2 pv). Kaupunki laskee parannukset tuottoihinsa, eikä keskustan oma kastelu tuplaannu. Tiet piirretään nauhoina ruutujen välille, ja kastelu ja kaivos ovat merkkejä ruudun keskipisteen vieressä. HUD kertoo valmistumisesta. Kaupunkiehdotus ottaa Kehitä-tilassa olevan uudisasukkaan, jos Asuta-tilassa ei ole ketään. Kaupunki rakentaa soturin jälkeen uudisasukkaita.",
  "impact_analysis": {
    "changed_symbols": [
      "Unit.task ja Unit.job; Units.setTask; Units.settler on ensimmäinen Asuta-tilassa oleva uudisasukas",
      "World.nextJob ja World.improve (valinnaiset)",
      "cityDay: valmis soturi vaihtaa rakennuksen uudisasukkaaseen",
      "UnitView.improvements",
      "GameHudState.unit.task ja GameHudHandlers.setTask",
      "main.ts: Play.improvements, yieldOf, workedByCity, nextJob, idleSettler, sendSettler",
      "globeDebug.spawnSettler, yieldOf ja worked; globeGame.state.improvements sekä yksiköiden task ja job"
    ],
    "call_sites_found": [
      "Units.settler: findSites, setSite, found, nextSite, unitStatus, unitLayer.updatePaths, main.ts (HUD, idleSettler, noteSiteOffer)",
      "cityDay: main.ts cityDays",
      "yieldOf: cityYields, siteYield, workedByCity"
    ],
    "call_sites_updated": [
      "src/globe/unitLayer.ts",
      "src/globe/main.ts"
    ],
    "compile_errors_before": 0,
    "compile_errors_after": 0,
    "notes": "Kaupunkitestin rakennusjärjestys muuttui tarkoituksella: soturin jälkeen rakennus on uudisasukas, ja Vaihda vaihtaa takaisin soturiin."
  },
  "commit": "343bf3d",
  "progress": 100
}
