{
  "id": "TICKET-IMPL-047",
  "story": "STORY-056",
  "plan": "PLAN-047",
  "implemented_by_model": "Opus 5.5",
  "status": "done",
  "files_changed": [
    "src/game/goals.ts",
    "src/game/goals.test.ts",
    "src/globe/main.ts"
  ],
  "change_summary": "Kuusi uutta tavoitetta ja GoalStaten kentät advisor, monarchy ja provinces; main.ts laskee ne.",
  "impact_analysis": {
    "changed_symbols": [
      "GoalState",
      "GOALS"
    ],
    "call_sites_found": [
      "checkGoals"
    ],
    "call_sites_updated": [
      "src/globe/main.ts"
    ],
    "compile_errors_before": 0,
    "compile_errors_after": 0,
    "notes": "Kiinnike-testin \"edellä oleva peli\" sai uudet kentät, jotta se kattaa koko ketjun; tarkistus ei muuttunut."
  },
  "commit": "1e63f07",
  "progress": 100
}
