{
  "id": "TICKET-IMPL-050",
  "story": "STORY-059",
  "plan": "PLAN-050",
  "implemented_by_model": "Opus 5.5",
  "status": "done",
  "files_changed": [
    "src/game/units.ts",
    "src/game/units.test.ts",
    "src/game/science.ts",
    "src/game/advisors.ts",
    "src/globe/main.ts",
    "tests/e2e/tile-card.e2e.ts"
  ],
  "change_summary": "World.travel ja travel() reiteille, askeleille ja päiville; kohteet pysyvät maalla. main.ts: coastal(), canSail() ja world.travel; kortin Kulku-rivi; ilmoitus keksinnöstä; testikoukku globeDebug.tileView.",
  "impact_analysis": {
    "changed_symbols": [
      "World.travel",
      "Units: reitit ja askeleet"
    ],
    "call_sites_found": [
      "findPath ja nearestTile units.ts:ssä"
    ],
    "call_sites_updated": [
      "src/game/units.ts"
    ],
    "compile_errors_before": 0,
    "compile_errors_after": 0,
    "notes": "Rosvot kulkevat yhä maitse."
  },
  "commit": "fb6941f",
  "progress": 100
}
